"Acceleration request, n., Gwabà","Accessory after the fact, n.,"
"kpala.","Zàgwapa zunma gànjiṇ o."
"Acceleration stress, n., Bapà kpala.","Accessory apartment, n., Katakányí"
"Accelerator, n., Kpalaci.","nyạgwabe."
"Accelerator card, n., Vòkpalú kpala.","Accessory before the fact, n.,"
"Accelerometer, n., Dǎmugikpala.","Zàgwapa bedzo gànjiṇ o."
"Accent, n., Dìmi; Edì mi.","Accessory mineral, n., Kùjá"
"Accent lighting, n., Bàtiṇgi dìmi.","nyạgwabe."
"Accented, adj., Bamdìmi.","Accessory nerve, n., Dìṇkiṇ"
"Accentual, adj., Nyidìmi.","nyạgwabe."
"Accentuate, v., Ròdìmi.","Accessory pigment, n., Ètạngi"
"Accept, v., Gò; Gòyé.","nyạgwabe."
"Acceptable, adj., Yégòci.","Accessory shoe, n., Èdà nyạgwabe."
"Acceptable daily intake, n., Gínyi","Accessible, adj., kpagàyéci."
"fondodò yégòci.","Accession, n., Kpagàyé."
"Acceptance, n., Yégò.","Accession country, n., Kinkpò"
"Acceptance agent, n., Zàtun yégò.","kpagàyé."
"Acceptance bonus, n., Wǎngigi","Access number, n., Dókuṇgi kpagà."
"yégò.","Access point, n., Tígi kpagà."
"Acceptance sampling, n.,","Access profile, n., Furusàngi kpagà."
"Màmakicigi yégò.","Access time, n., Èká kpagà."
"Acceptation, n., Yiyégò.","Access URL, n., URL i kpagà."
"Accepter, n., Yégòci.","Acciaccatura, n., Níbíngi; Ení"
"Accepting, n., Gugòyé.","ebíngi."
"Accepting house, n., Emì Gugòyé.","Accidence, n., Titánkîn."
"Acceptor, n., Zayégòci.","Accident, n., Kîntán."
"Access, v., Gàkpa; Gà ekpa.","Accidental, adj., Kîntánci."
"Access, n., Ekpagà.","Accidental death, n., Tsutsu Kîntán."
"Access broker, n., Shìkwatia kpagà.","Accidental death and"
"Access charge, n., Wókàrà kpagà.","dismemberment, n., Tsutsu"
"Access code, n., Fínmi kpagà.","Kîntán be bàgúṇnyi."
"Access control, n., Shikàngi kpagà.","Accident and emergency, n., Kîntán"
"Accessory, n., Nyạgwabe; Enyạ egwa","be dzùṇdzùṇběgà e."
"be.","Accident insurance, n., Nyạgbànbá"
"Accessory (criminal abetter),n.,","kîntán."
"Zàgwapa.","Accident-prone, Bambókîntán."
